{
  "profile": "fullstack",
  "install_vscode_extensions": true,
  "non_interactive": false,
  "runtime_versions": {
    "node": "",
    "python": "",
    "dotnet": "",
    "java": "",
    "php": ""
  },
  "git": {
    "name": "",
    "email": ""
  },
  "features": {
    "docker": true,
    "wsl": true,
    "extras": false
  },
  "certificate": {
    "auto": false,
    "path": ""
  },
  "proxy": {
    "http": "",
    "https": "",
    "no_proxy": ""
  },
  "custom": {
    "windows_packages": [],
    "linux_packages": [],
    "vscode_extensions": []
  }
}
